<SetRoot ProjectId="DIHOST.Lenie" KeyVault="https://bissprodkeyvault.vault.azure.net/"
         xmlns:xsi="http://www.w3.org/2001/XMLSchema-instance" xmlns:xsd="http://www.w3.org/2001/XMLSchema"
         xsi:noNamespaceSchemaLocation="bs.xsd">
	<TargetDirectories>
		<SetProject RootFolder="BaseApp" />
		<SetProject RootFolder="BaseApp.View.Xamarin" />
		<SetProject RootFolder="WpfApp" />
		<SetProject RootFolder="AndroidApp" />
		<SetProject RootFolder="IOsApp" />
		<SetProject RootFolder="ConnectivityHost" CommonFile="LaunchConnectivityHost" />
		<SetProject RootFolder="Database" />
		<SetProject RootFolder="Exchange" CsSettings="Exchange" />
		<SetProject RootFolder="WebExchange" CsSettings="WebExchange" />
	</TargetDirectories>
	<CsSettings>
		<SetCsSetting FileName="AppSettings.cs" ForCsSettings="Exchange"
		              Usings="Exchange.Interfaces Biss.Apps.Components Biss.Apps.Connectivity.Interfaces Biss.Apps.Connectivity.Sa Biss.Apps.Enum Biss.Apps.Interfaces Biss.Apps.Model Biss.Dc.Client Biss.Apps.Map.Interface Biss.Apps.Push.Interfaces"
		              Interfaces="IAppSettings IAppSettingsNavigation IAppSettingsFiles IAppSettingConnectivity IAppSettingsPush IAppSettingsLinks IAppSettingsMap IAppSettingsAppCenter" />
		<SetCsSetting FileName="WebSettings.cs" ForCsSettings="WebExchange"
		              Usings="Biss.Apps.Service.Push WebExchange.Interfaces"
		              Interfaces="IWebSettingsAzureFiles IAppServiceSettingPush IAppSettingsDataBase IAppSettingsEMail IWebSettingsSms" />
	</CsSettings>
	<Properties>
		<SetProp Description="Produktversion" DefaultValue="1.4.1" PropType="Version" IsRequiredValue="true">
			<Targets>
				<SetTarget TargetType="CsProj" Destinations="Project/PropertyGroup/Version" />
				<SetTarget TargetType="AssemblyInfo" Destinations="AssemblyVersion AssemblyFileVersion" />
				<SetTarget TargetType="AndroidManifest" Destinations="manifest#android:versionName" />
				<SetTarget TargetType="InfoPlist" Destinations="CFBundleVersion CFBundleShortVersionString" />
				<SetTarget TargetType="CsSetting" Destinations="AppVersion" CsSettings="Exchange" />
			</Targets>
		</SetProp>

		<SetProp Description="DC Host - SignalR" DefaultValue="https://dihost-lenie-connectivityhost.azurewebsites.net">
			<Targets>
				<SetTarget TargetType="CsSetting" Destinations="DcSignalHost" CsSettings="Exchange" />
				<SetTarget TargetType="CommonFile" Destinations="Host" />
				<SetTarget TargetType="LaunchSettings"
				           Destinations="iisSettings/iisExpress#applicationUrl profiles/ServerApp#applicationUrl"
				           OnlyForProject="ConnectivityHost" />
			</Targets>
			<BranchValues>
				<SetBranchValue BranchName="beta" Value="https://dihost-lenie-connectivityhost-beta.azurewebsites.net">
				</SetBranchValue>
				<SetBranchValue BranchName="dev" Value="https://dihost-lenie-connectivityhost-dev.azurewebsites.net">
					<LocalOverrides>
					</LocalOverrides>
				</SetBranchValue>
			</BranchValues>
		</SetProp>

		<SetProp Description="SA Host - REST" DefaultValue="http://dihost-lenie-connectivityhost.azurewebsites.net/api/">
			<Targets>
				<SetTarget TargetType="CsSetting" Destinations="SaApiHost" CsSettings="Exchange" />
			</Targets>
			<BranchValues>
				<SetBranchValue BranchName="beta" Value="http://dihost-lenie-connectivityhost-beta.azurewebsites.net/api/">
				</SetBranchValue>
				<SetBranchValue BranchName="dev" Value="http://dihost-lenie-connectivityhost-dev.azurewebsites.net/api/">
				</SetBranchValue>
			</BranchValues>
		</SetProp>

		<SetProp Description="App Name" DefaultValue="LENIE">
			<Targets>
				<SetTarget TargetType="AndroidManifest" Destinations="manifest/application#android:label" />
				<SetTarget TargetType="InfoPlist" Destinations="CFBundleDisplayName" />
				<SetTarget TargetType="CsSetting" Destinations="AppName" CsSettings="Exchange" />
			</Targets>
			<BranchValues>
				<SetBranchValue BranchName="beta" Value="LENIE Beta" />
				<SetBranchValue BranchName="dev" Value="LENIE Dev" />
			</BranchValues>
		</SetProp>

		<SetProp Description="App Identifier" DefaultValue="at.dihost.lenie">
			<Targets>
				<SetTarget TargetType="AndroidManifest" Destinations="manifest#package" />
				<SetTarget TargetType="InfoPlist" Destinations="CFBundleIdentifier" />
				<SetTarget TargetType="CsSetting" Destinations="PackageName" CsSettings="Exchange" />
			</Targets>
			<BranchValues>
				<SetBranchValue BranchName="beta" Value="at.dihost.lenie.beta" />
				<SetBranchValue BranchName="dev" Value="at.dihost.lenie.dev" />
			</BranchValues>
		</SetProp>

		<SetProp Description="App Ordner auf Plattform" DefaultValue="Lenie">
			<Targets>
				<SetTarget TargetType="CsSetting" Destinations="ProjectWorkUserFolder" CsSettings="Exchange" />
			</Targets>
			<BranchValues>
				<SetBranchValue BranchName="beta" Value="LenieBeta" />
				<SetBranchValue BranchName="dev" Value="LenieDev" />
			</BranchValues>
		</SetProp>

		<SetProp Description="Id des Notification-Channels" DefaultValue="DefaultId">
			<Targets>
				<SetTarget TargetType="CsSetting" Destinations="NotificationChannelId" CsSettings="Exchange" />
			</Targets>
		</SetProp>

		<SetProp Description="Name des Notification-Channels" DefaultValue="PushBenachrichtigungen">
			<Targets>
				<SetTarget TargetType="CsSetting" Destinations="NotificationChannelName" CsSettings="Exchange" />
			</Targets>
		</SetProp>

		<SetProp
			Description="Push - Firebase Project Id - &lt;inheritdoc cref=&quot;IAppServiceSettingPush.PushProjectId&quot;/&gt;"
			DefaultValue="dihost-lenie">
			<Targets>
				<SetTarget TargetType="CsSetting" Destinations="PushProjectId" CsSettings="WebExchange" />
			</Targets>
		</SetProp>

		<SetProp
			Description="Push - Firebase Service Account Id - &lt;inheritdoc cref=&quot;IAppServiceSettingPush.PushServiceAccountId&quot;/&gt;"
			DefaultValue="DIHOST:LENIE:PushServiceAccountId" IsRequiredValue="true" IsSecureProperty="true">
			<Targets>
				<SetTarget TargetType="CsSetting" Destinations="PushServiceAccountId" CsSettings="WebExchange" />
			</Targets>
		</SetProp>

		<SetProp
			Description="Push - Firebase Private Key Id - &lt;inheritdoc cref=&quot;IAppServiceSettingPush.PushPrivateKeyId&quot;/&gt;"
			DefaultValue="DIHOST:LENIE:PushPrivateKeyId" IsRequiredValue="true" IsSecureProperty="true">
			<Targets>
				<SetTarget TargetType="CsSetting" Destinations="PushPrivateKeyId " CsSettings="WebExchange" />
			</Targets>
		</SetProp>

		<SetProp
			Description="Push - Firebase Private Key - &lt;inheritdoc cref=&quot;IAppServiceSettingPush.PushPrivateKey&quot;/&gt;"
			DefaultValue="DIHOST:LENIE:PushPrivateKey" IsRequiredValue="true" IsSecureProperty="true">
			<Targets>
				<SetTarget TargetType="CsSetting" Destinations="PushPrivateKey " CsSettings="WebExchange" />
			</Targets>
		</SetProp>

		<SetProp Description="Standard Topic" DefaultValue="DEFAULT">
			<Targets>
				<SetTarget TargetType="CsSetting" Destinations="DefaultTopic" CsSettings="Exchange" />
			</Targets>
		</SetProp>

		<SetProp Description="Bing Maps Key - WPF (VWT)" DefaultValue="FOTEC:BingMapsKey" IsRequiredValue="true"
		         IsSecureProperty="true">
			<Targets>
				<SetTarget TargetType="CsSetting" Destinations="BingMapsKey" CsSettings="Exchange" />
			</Targets>
		</SetProp>

		<SetProp Description="Google Maps Key Android und Blazor" DefaultValue="FOTEC:GoogleMapsKey" IsRequiredValue="true"
		         IsSecureProperty="true">
			<Targets>
				<SetTarget TargetType="CsSetting" Destinations="GoogleMapsKey" CsSettings="Exchange" />
				<SetTarget TargetType="AndroidManifest"
				           Destinations="manifest/application/meta-data#android:value##android:name=com.google.android.geo.API_KEY" />
				<SetTarget TargetType="IndexHtml" Destinations="GOOGLEMAPKEY" />
			</Targets>
		</SetProp>

		<SetProp Description="Datenbank" DefaultValue="lenie-db-release">
			<Targets>
				<SetTarget TargetType="CsSetting" Destinations="ConnectionStringDb" CsSettings="WebExchange" />
			</Targets>
			<BranchValues>
				<SetBranchValue BranchName="beta" Value="lenie-db-beta" />
				<SetBranchValue BranchName="dev" Value="lenie-db-dev" />
			</BranchValues>
		</SetProp>

		<SetProp Description="Datenbank-Server" DefaultValue="DIHOST:LENIE:SqlServer" IsRequiredValue="true"
		         IsSecureProperty="true">
			<Targets>
				<SetTarget TargetType="CsSetting" Destinations="ConnectionStringDbServer" CsSettings="WebExchange" />
			</Targets>
		</SetProp>

		<SetProp Description="Datenbank User" DefaultValue="DIHOST:LENIE:SqlServerUser" IsRequiredValue="true"
		         IsSecureProperty="true">
			<Targets>
				<SetTarget TargetType="CsSetting" Destinations="ConnectionStringUser" CsSettings="WebExchange" />
			</Targets>
		</SetProp>

		<SetProp Description="Datenbank User Passwort" DefaultValue="DIHOST:LENIE:SqlServerPassword" IsRequiredValue="true"
		         IsSecureProperty="true">
			<Targets>
				<SetTarget TargetType="CsSetting" Destinations="ConnectionStringUserPwd" CsSettings="WebExchange" />
			</Targets>
		</SetProp>

		<SetProp Description="Connection string für den Blob" DefaultValue="DIHOST:LENIE:BlobConString"
		         IsRequiredValue="true" IsSecureProperty="true">
			<Targets>
				<SetTarget TargetType="CsSetting" Destinations="BlobConnectionString" CsSettings="WebExchange" />
			</Targets>
		</SetProp>

		<SetProp Description="Container Name im Blob" DefaultValue="lenierelease">
			<Targets>
				<SetTarget TargetType="CsSetting" Destinations="BlobContainerName" CsSettings="WebExchange" />
			</Targets>
			<BranchValues>
				<SetBranchValue BranchName="beta" Value="leniebeta" />
				<SetBranchValue BranchName="dev" Value="leniedev" />
			</BranchValues>
		</SetProp>

		<SetProp Description="Cdn link oder public Bloblink für Filelink"
		         DefaultValue="https://leniestorage.blob.core.windows.net/">
			<Targets>
				<SetTarget TargetType="CsSetting" Destinations="CdnLink" CsSettings="WebExchange" />
			</Targets>